{
  "format": "lifehouse-score",
  "version": "0.1.0",
  "source_project_id": "lifehouse-demo-five-voices",
  "engine": "lifehouse-circumplex-demo-v0.1",
  "include_sociometry": true,
  "bpm": 112,
  "bars": 12,
  "meter": [
    4,
    4
  ],
  "scale": "d_dorian",
  "duration_seconds": 25.714285714285715,
  "notes": [
    {
      "person_id": "p02",
      "related_to": null,
      "kind": "individual",
      "midi": 62,
      "start_beat": 0,
      "duration_beats": 0.77,
      "velocity": 77,
      "channel": 1
    },
    {
      "person_id": "p01",
      "related_to": null,
      "kind": "individual",
      "midi": 71,
      "start_beat": 0,
      "duration_beats": 0.46,
      "velocity": 84,
      "channel": 0
    },
    {
      "person_id": "p05",
      "related_to": null,
      "kind": "individual",
      "midi": 76,
      "start_beat": 0.5,
      "duration_beats": 0.77,
      "velocity": 87,
      "channel": 4
    },
    {
      "person_id": "p03",
      "related_to": null,
      "kind": "individual",
      "midi": 60,
      "start_beat": 1.5,
      "duration_beats": 0.46,
      "velocity": 80,
      "channel": 2
    },
    {
      "person_id": "p04",
      "related_to": null,
      "kind": "individual",
      "midi": 53,
      "start_beat": 2,
      "duration_beats": 0.46,
      "velocity": 67,
      "channel": 3
    },
    {
      "person_id": "p01",
      "related_to": null,
      "kind": "individual",
      "midi": 74,
      "start_beat": 2,
      "duration_beats": 0.46,
      "velocity": 84,
      "channel": 0
    },
    {
      "person_id": "p02",
      "related_to": "p01",
      "kind": "sociometric_echo",
      "midi": 59,
      "start_beat": 2.5,
      "duration_beats": 0.7,
      "velocity": 67,
      "channel": 1
    },
    {
      "person_id": "p02",
      "related_to": "p03",
      "kind": "sociometric_echo",
      "midi": 60,
      "start_beat": 2.5,
      "duration_beats": 0.7,
      "velocity": 70,
      "channel": 1
    },
    {
      "person_id": "p04",
      "related_to": "p03",
      "kind": "sociometric_echo",
      "midi": 60,
      "start_beat": 2.5,
      "duration_beats": 0.7,
      "velocity": 69,
      "channel": 3
    },
    {
      "person_id": "p03",
      "related_to": "p05",
      "kind": "sociometric_echo",
      "midi": 64,
      "start_beat": 2.5,
      "duration_beats": 0.7,
      "velocity": 64,
      "channel": 2
    },
    {
      "person_id": "p05",
      "related_to": "p04",
      "kind": "sociometric_echo",
      "midi": 65,
      "start_beat": 2.5,
      "duration_beats": 0.7,
      "velocity": 57,
      "channel": 4
    },
    {
      "person_id": "p05",
      "related_to": "p01",
      "kind": "sociometric_echo",
      "midi": 71,
      "start_beat": 2.5,
      "duration_beats": 0.7,
      "velocity": 69,
      "channel": 4
    },
    {
      "person_id": "p01",
      "related_to": "p02",
      "kind": "sociometric_echo",
      "midi": 74,
      "start_beat": 2.5,
      "duration_beats": 0.7,
      "velocity": 73,
      "channel": 0
    },
    {
      "person_id": "p05",
      "related_to": null,
      "kind": "individual",
      "midi": 79,
      "start_beat": 2.5,
      "duration_beats": 0.77,
      "velocity": 87,
      "channel": 4
    },
    {
      "person_id": "p02",
      "related_to": null,
      "kind": "individual",
      "midi": 64,
      "start_beat": 3,
      "duration_beats": 0.77,
      "velocity": 77,
      "channel": 1
    },
    {
      "person_id": "p01",
      "related_to": null,
      "kind": "individual",
      "midi": 74,
      "start_beat": 3,
      "duration_beats": 0.46,
      "velocity": 84,
      "channel": 0
    },
    {
      "person_id": "p05",
      "related_to": null,
      "kind": "individual",
      "midi": 79,
      "start_beat": 3,
      "duration_beats": 0.77,
      "velocity": 87,
      "channel": 4
    },
    {
      "person_id": "p03",
      "related_to": null,
      "kind": "individual",
      "midi": 62,
      "start_beat": 4,
      "duration_beats": 0.46,
      "velocity": 80,
      "channel": 2
    },
    {
      "person_id": "p01",
      "related_to": null,
      "kind": "individual",
      "midi": 77,
      "start_beat": 4,
      "duration_beats": 0.46,
      "velocity": 84,
      "channel": 0
    },
    {
      "person_id": "p05",
      "related_to": null,
      "kind": "individual",
      "midi": 83,
      "start_beat": 4.5,
      "duration_beats": 0.77,
      "velocity": 87,
      "channel": 4
    },
    {
      "person_id": "p04",
      "related_to": null,
      "kind": "individual",
      "midi": 55,
      "start_beat": 5,
      "duration_beats": 0.46,
      "velocity": 67,
      "channel": 3
    },
    {
      "person_id": "p02",
      "related_to": null,
      "kind": "individual",
      "midi": 65,
      "start_beat": 6,
      "duration_beats": 0.77,
      "velocity": 77,
      "channel": 1
    },
    {
      "person_id": "p01",
      "related_to": null,
      "kind": "individual",
      "midi": 81,
      "start_beat": 6,
      "duration_beats": 0.46,
      "velocity": 84,
      "channel": 0
    },
    {
      "person_id": "p03",
      "related_to": null,
      "kind": "individual",
      "midi": 64,
      "start_beat": 6.5,
      "duration_beats": 0.46,
      "velocity": 80,
      "channel": 2
    },
    {
      "person_id": "p05",
      "related_to": null,
      "kind": "individual",
      "midi": 86,
      "start_beat": 6.5,
      "duration_beats": 0.77,
      "velocity": 87,
      "channel": 4
    },
    {
      "person_id": "p01",
      "related_to": null,
      "kind": "individual",
      "midi": 81,
      "start_beat": 7,
      "duration_beats": 0.46,
      "velocity": 84,
      "channel": 0
    },
    {
      "person_id": "p05",
      "related_to": null,
      "kind": "individual",
      "midi": 86,
      "start_beat": 7,
      "duration_beats": 0.77,
      "velocity": 87,
      "channel": 4
    },
    {
      "person_id": "p04",
      "related_to": null,
      "kind": "individual",
      "midi": 57,
      "start_beat": 8,
      "duration_beats": 0.46,
      "velocity": 67,
      "channel": 3
    },
    {
      "person_id": "p01",
      "related_to": null,
      "kind": "individual",
      "midi": 72,
      "start_beat": 8,
      "duration_beats": 0.46,
      "velocity": 84,
      "channel": 0
    },
    {
      "person_id": "p05",
      "related_to": null,
      "kind": "individual",
      "midi": 77,
      "start_beat": 8.5,
      "duration_beats": 0.77,
      "velocity": 87,
      "channel": 4
    },
    {
      "person_id": "p03",
      "related_to": null,
      "kind": "individual",
      "midi": 65,
      "start_beat": 9,
      "duration_beats": 0.46,
      "velocity": 80,
      "channel": 2
    },
    {
      "person_id": "p02",
      "related_to": null,
      "kind": "individual",
      "midi": 67,
      "start_beat": 9,
      "duration_beats": 0.77,
      "velocity": 77,
      "channel": 1
    },
    {
      "person_id": "p01",
      "related_to": null,
      "kind": "individual",
      "midi": 76,
      "start_beat": 10,
      "duration_beats": 0.46,
      "velocity": 84,
      "channel": 0
    },
    {
      "person_id": "p02",
      "related_to": "p03",
      "kind": "sociometric_echo",
      "midi": 62,
      "start_beat": 10.5,
      "duration_beats": 0.7,
      "velocity": 70,
      "channel": 1
    },
    {
      "person_id": "p04",
      "related_to": "p03",
      "kind": "sociometric_echo",
      "midi": 62,
      "start_beat": 10.5,
      "duration_beats": 0.7,
      "velocity": 69,
      "channel": 3
    },
    {
      "person_id": "p01",
      "related_to": "p02",
      "kind": "sociometric_echo",
      "midi": 76,
      "start_beat": 10.5,
      "duration_beats": 0.7,
      "velocity": 73,
      "channel": 0
    },
    {
      "person_id": "p05",
      "related_to": null,
      "kind": "individual",
      "midi": 81,
      "start_beat": 10.5,
      "duration_beats": 0.77,
      "velocity": 87,
      "channel": 4
    },
    {
      "person_id": "p04",
      "related_to": null,
      "kind": "individual",
      "midi": 59,
      "start_beat": 11,
      "duration_beats": 0.46,
      "velocity": 67,
      "channel": 3
    },
    {
      "person_id": "p01",
      "related_to": null,
      "kind": "individual",
      "midi": 76,
      "start_beat": 11,
      "duration_beats": 0.46,
      "velocity": 84,
      "channel": 0
    },
    {
      "person_id": "p05",
      "related_to": null,
      "kind": "individual",
      "midi": 81,
      "start_beat": 11,
      "duration_beats": 0.77,
      "velocity": 87,
      "channel": 4
    },
    {
      "person_id": "p03",
      "related_to": null,
      "kind": "individual",
      "midi": 67,
      "start_beat": 11.5,
      "duration_beats": 0.46,
      "velocity": 80,
      "channel": 2
    },
    {
      "person_id": "p02",
      "related_to": null,
      "kind": "individual",
      "midi": 69,
      "start_beat": 12,
      "duration_beats": 0.77,
      "velocity": 77,
      "channel": 1
    },
    {
      "person_id": "p01",
      "related_to": null,
      "kind": "individual",
      "midi": 79,
      "start_beat": 12,
      "duration_beats": 0.46,
      "velocity": 84,
      "channel": 0
    },
    {
      "person_id": "p05",
      "related_to": null,
      "kind": "individual",
      "midi": 84,
      "start_beat": 12.5,
      "duration_beats": 0.77,
      "velocity": 87,
      "channel": 4
    },
    {
      "person_id": "p04",
      "related_to": null,
      "kind": "individual",
      "midi": 60,
      "start_beat": 14,
      "duration_beats": 0.46,
      "velocity": 67,
      "channel": 3
    },
    {
      "person_id": "p03",
      "related_to": null,
      "kind": "individual",
      "midi": 69,
      "start_beat": 14,
      "duration_beats": 0.46,
      "velocity": 80,
      "channel": 2
    },
    {
      "person_id": "p01",
      "related_to": null,
      "kind": "individual",
      "midi": 71,
      "start_beat": 14,